onet_soc_code,canonical_title,normalized_canonical_title,matched_target_families,alternate_title_count,knowledge_count,technology_example_count,sample_alternate_titles,sample_top_knowledge,sample_top_technology_examples
19-3032.00,Industrial-Organizational Psychologists,industrial-organizational psychologists,data_science,27,4,15,Consulting Psychologist | Engineering Psychologist | HR Consultant (Human Resources Consultant) | HR OD Consultant (Human Resources Organizational Development Consultant) | HR Psychologist (Human Resources Psychologist) | I-O Practitioner (Industrial-Organizational Practitioner) | I-O Psychologist (Industrial-Organizational Psychologist) | Industrial Psychologist,mathematics | computers and electronics | engineering and technology | telecommunications,adobe acrobat | google sheets | hypertext markup language html | ibm spss statistics | microsoft access | microsoft excel | microsoft project | microsoft visio
19-3033.00,Clinical and Counseling Psychologists,clinical and counseling psychologists,,55,4,15,Applied Behavior Science Specialist (ABSS) | Assessment Coordinator | Behavior Analyst | Behavior Specialist | Behavior Therapist | Behavioral Analyst | Behavioral Health Specialist | Behavioral Psychologist,computers and electronics | mathematics | telecommunications | engineering and technology,microsoft teams | zoom | eclinicalworks ehr software | google docs | google sheets | microsoft excel | google meet | addison health systems writepad ehr
19-3034.00,School Psychologists,school psychologists,,29,4,15,Area School Psychologist | Assessment Specialist | Autism Consultant | Behavior Specialist | Behavioral Analyst | Behavioral Specialist | Bilingual School Psychologist | Certified School Psychologist,mathematics | computers and electronics | telecommunications | engineering and technology,microsoft excel | zoom | centris group iep direct | centris group rtim direct | chalkware education solutions ieppro | email software | ewing solutions quickwriter | global education technologies excent
19-3039.00,"Psychologists, All Other",psychologists all other,,32,0,0,Behavior Analyst | Behavioral Analyst | Behavioral Scientist | Behavioral Specialist | Biopsychologist | Developmental Psychologist | Ethnologist | Experimental Psychologist,,
19-3039.02,Neuropsychologists,neuropsychologists,,9,4,15,Adult Neuropsychologist | Aviation Neuropsychologist | Board Certified Neuropsychologist | Child and Adolescent Neuropsychologist | Forensic Neuropsychologist | Neuropsychologist | Neuropsychology Medical Consultant | Pediatric Neuropsychologist,mathematics | computers and electronics | telecommunications | engineering and technology,ibm spss statistics | microsoft excel | automated neuropsychological metric assessments battery | behavioral assessment and research system bars | brainmetric the category test | braintrain captain s log | cognisyst computerized assessment of response bias carb | conners continuous performance test ii
19-3039.03,Clinical Neuropsychologists,clinical neuropsychologists,,8,4,15,Adult Neuropsychologist | Aviation Neuropsychologist | Board Certified Clinical Neuropsychologist | Clinical Neuropsychologist | Neuropsychology Medical Consultant | Pediatric Clinical Neuropsychologist | Pediatric Neuropsychologist | Staff Psychologist,mathematics | computers and electronics | telecommunications | engineering and technology,ibm spss statistics | microsoft excel | automated neuropsychological metric assessments battery | behavioral assessment and research system bars | brainmetric the category test | braintrain captain s log | cognisyst computerized assessment of response bias carb | conners continuous performance test ii
19-3041.00,Sociologists,sociologists,data_science,21,4,15,Clinical Evaluator | Clinical Sociologist | Criminologist | Demographer | Evaluation Specialist | Family Sociologist | Medical Sociologist | Penologist,mathematics | computers and electronics | telecommunications | engineering and technology,adobe acrobat | adobe photoshop | esri arcgis software | facebook | ibm spss statistics | microsoft access | microsoft excel | microsoft project
19-3051.00,Urban and Regional Planners,urban and regional planners,,35,4,15,Campus Planner | City Designer | City Planner | City Planning Engineer | Community Development Planner | Community Development Technician | Community Planner | Community Planning Technician,computers and electronics | mathematics | engineering and technology | telecommunications,autodesk autocad | esri arcgis software | microsoft excel | adobe acrobat | adobe creative cloud software | adobe illustrator | adobe indesign | adobe photoshop
19-3091.00,Anthropologists and Archeologists,anthropologists and archeologists,,28,4,15,American Indian Policy Specialist | Anthropologist | Applied Anthropologist | Applied Cultural Anthropologist | Archaeological Field Technician | Archaeological Technician (Archeological Tech) | Archaeologist | Archeologist,computers and electronics | mathematics | telecommunications | engineering and technology,esri arcgis software | microsoft excel | adobe acrobat | adobe illustrator | adobe indesign | adobe photoshop | autodesk autocad | c++
19-3092.00,Geographers,geographers,,15,4,15,Biogeographer | Cultural Resources Specialist | Earth Observations Scientist | Economic Geographer | GIS Coordinator (Geographic Information Systems Coordinator) | GIS Geographer (Geographic Information Systems Geographer) | GIS Physical Scientist (Geographic Information Systems Physical Scientist) | Geographer,computers and electronics | mathematics | engineering and technology | telecommunications,esri arcgis software | microsoft excel | python | r | structured query language sql | adobe photoshop | autodesk autocad | ibm spss statistics
19-3093.00,Historians,historians,,30,4,15,Architectural Historian | Art Historian | Collections Specialist | County Historian | Dance Historian | Dramatic Arts Historian | Field Court Researcher | Film Historian,computers and electronics | mathematics | telecommunications | engineering and technology,esri arcgis software | microsoft excel | adobe acrobat | adobe indesign | adobe photoshop | extensible markup language xml | ibm spss statistics | microsoft access
19-3094.00,Political Scientists,political scientists,data_science,23,4,15,Citizen Participation Specialist | Government Affairs Researcher | Government Affairs Specialist | Health Policy Analyst | Legislative Affairs Specialist | Legislative Analyst | Legislative Liaison | Legislative Policy Analyst,mathematics | computers and electronics | telecommunications | engineering and technology,microsoft excel | adobe acrobat | ibm spss statistics | microsoft access | microsoft active server pages asp | microsoft sharepoint | microsoft visio | python
19-3099.00,"Social Scientists and Related Workers, All Other",social scientists and related workers all other,data_science,31,0,0,Behavioral Scientist | Computational Linguist | Demographer | Developmental Psychologist | Director of Research | Ethnologist | Etymologist | Experimental Psychologist,,
19-3099.01,Transportation Planners,transportation planners,,18,4,15,Airway Transportation Systems Specialist (ATSS) | Fleet Coordinator | Planner | Program Officer | Traffic Analyst | Transit Planner | Transportation Analyst | Transportation Consultant,mathematics | computers and electronics | engineering and technology | telecommunications,esri arcgis software | microsoft access | microsoft excel | microsoft power bi | python | structured query language sql | tableau | adobe acrobat
19-4012.00,Agricultural Technicians,agricultural technicians,,54,4,11,Acidity Tester | Agricultural Assistant | Agricultural Equipment Technician | Agricultural Research Technician (Agricultural Research Tech) | Agricultural Research Technologist | Agricultural Service Technician | Agricultural Specialist | Agricultural Technician (Agricultural Tech),mathematics | engineering and technology | computers and electronics | telecommunications,microsoft excel | microsoft access | sap software | desktop publishing software | email software | geographic information system gis systems | global positioning system gps software | spreadsheet software
19-4012.01,Precision Agriculture Technicians,precision agriculture technicians,,22,4,15,Agriculture Specialist | Agriculture Technician (Agriculture Tech) | Agrintelligence Specialist (Agriculture Intelligence Specialist) | Agronomist | Agronomy Consultant | Agronomy Specialist | Certified Crop Specialist | Crop Consultant,computers and electronics | mathematics | engineering and technology | telecommunications,microsoft excel | esri arcgis software | microsoft access | microsoft windows | ag leader technology sms advanced | agco gta software suite | esri arcpad | esri arcview
19-4013.00,Food Science Technicians,food science technicians,,45,4,15,Beer Brewer | Biotechnician | Bottle House QC Technician (Bottle House Quality Control Technician) | Butter Fat Tester | Central Laboratory Technician (CLT) | Cheese Tester | Cream Tester | Dairy Laboratory Technician (Dairy Lab Tech),computers and electronics | mathematics | engineering and technology | telecommunications,microsoft excel | linux | microsoft access | microsoft sql server | microsoft visio | sap software | sas | apache jmeter
19-4021.00,Biological Technicians,biological technicians,,58,4,15,Aquatic Technician (Aquatic Tech) | Aquatics Technician | Artificial Breeding Laboratory Technician (Artificial Breeding Lab Tech) | Artificial Breeding Technician | Artificial Inseminator | Babcock Tester | Bacteriology Research Assistant | Bacteriology Technician,mathematics | computers and electronics | engineering and technology | telecommunications,microsoft excel | microsoft net framework | adobe acrobat | adobe photoshop | esri arcgis software | microsoft access | microsoft project | sas
19-4031.00,Chemical Technicians,chemical technicians,,92,4,15,Analysis Tester | Analytical Laboratory Technician (Analytical Lab Technician) | Analytical Technician | Assayer | Bleach Analyst | Chemical Analyst | Chemical Analytical Sampler | Chemical Dependency Technician (Chemical Dependency Tech),mathematics | computers and electronics | engineering and technology | telecommunications,microsoft excel | c++ | linux | microsoft access | oracle database | oracle java | python | r
19-4042.00,"Environmental Science and Protection Technicians, Including Health",environmental science and protection technicians including health,,76,4,15,Air Analyst | Air Pollution Auditor | Air Quality Technician (Air Quality Tech) | Analytical Lab Tech (Analytical Laboratory Technician) | Asbestos Abatement Technician (Asbestos Abatement Tech) | Asbestos Microscopist | Biological Lab Tech (Biological Laboratory Technician) | Biotechnician,computers and electronics | mathematics | engineering and technology | telecommunications,microsoft excel | adobe acrobat | autodesk autocad | esri arcgis software | microsoft access | microsoft project | sap software | autodesk softdesk
19-4043.00,"Geological Technicians, Except Hydrologic Technicians",geological technicians except hydrologic technicians,,122,4,15,Acid Tester | Chalk Tester | Construction Material Technician | Construction Materials Field Technician (Construction Materials Field Tech) | Construction Materials Technician (Construction Materials Tech) | Construction Materials Testing Technician (Construction Materials Testing Tech) | Core Inspector | Crude Tester,computers and electronics | engineering and technology | mathematics | telecommunications,microsoft excel | adobe illustrator | autodesk autocad | esri arcgis software | microsoft access | sap software | clark labs idrisi andes | corel coreldraw graphics suite
19-4044.00,Hydrologic Technicians,hydrologic technicians,,8,0,15,Field Technician (Field Tech) | GIS Technician (Geographic Information System Technician) | Groundwater Monitoring Technician | Hydro Operator | Hydrographer | Hydrography Technician | Hydrologic Aid | Hydrologic Technician,,microsoft excel | adobe acrobat | esri arcgis software | microsoft access | microsoft active server pages asp | microsoft windows | geographic information system gis systems | datasurge geopro
19-4051.00,Nuclear Technicians,nuclear technicians,,35,4,12,Accelerator Operator | Accelerator Technician | Auxiliary Operator | Cell Support Operator | Electric Systems Operator | Energy Systems Operator | Equipment Operation Instructor | Equipment Operator,engineering and technology | computers and electronics | mathematics | telecommunications,linux | microsoft access | microsoft excel | microsoft windows | structured query language sql | data logging software | database software | spreadsheet software
19-4051.02,Nuclear Monitoring Technicians,nuclear monitoring technicians,,23,4,14,Cathodic Protection Technician | Chemical Radiation Technician | Decontaminator | Health Physics Technician (HP Tech) | Instrumentation Control Specialist | Laboratory Control Specialist | Metallographic Technician | Nuclear Chemistry Technician,mathematics | computers and electronics | telecommunications | engineering and technology,microsoft excel | microsoft azure software | microsoft windows | microsoft windows server | oracle java | structured query language sql | aveva intouch hmi | connectivity software
19-4061.00,Social Science Research Assistants,social science research assistants,"analytics,data_science",28,4,15,Bilingual Research Interviewer | Clinical Research Assistant | Data Analyst | Economic Research Assistant | Economist Research Assistant | Graduate Assistant | Graduate Research Assistant | Historian Research Assistant,computers and electronics | mathematics | telecommunications | engineering and technology,microsoft excel | python | r | adobe illustrator | adobe indesign | c++ | esri arcgis software | extensible markup language xml
19-4071.00,Forest and Conservation Technicians,forest and conservation technicians,,20,4,15,Biological Science Aide | Conservation Agent | Conservation Officer | Conservation Technician | Field Technician (Field Tech) | Forest Technician | Forester Aide | Forestry Aid Technician,mathematics | computers and electronics | telecommunications | engineering and technology,esri arcgis software | facebook | microsoft access | microsoft active server pages asp | microsoft excel | geographic information system gis systems | allegro landmark | assisi compiler
19-4092.00,Forensic Science Technicians,forensic science technicians,,50,4,15,Ballistician | Ballistics Technician (Ballistics Tech) | Biometric Fingerprint Technician (Biometric Fingerprint Tech) | Biometric Fingerprinting Technician (Biometric Fingerprinting Tech) | Biometrician | Blood Splatter Analyst | CSI (Crime Scene Investigator) | Computer Forensics Technician (Computer Forensics Tech),computers and electronics | telecommunications | mathematics | engineering and technology,microsoft excel | adobe photoshop | linux | microsoft access | microsoft visio | guidance software encase enterprise | automated biometric identification system abis | combined dna index system codis
19-4099.00,"Life, Physical, and Social Science Technicians, All Other",life physical and social science technicians all other,,45,0,0,Assistant Oceanographer | Biomedical Instrument Technician | City Planning Aide | Colorist | Data Reduction Technician | Excavator | Gamma Facilities Operator | Gamma Ray Operator,,
19-4099.01,Quality Control Analysts,quality control analysts,,41,4,15,Chemistry Quality Control Analyst (Chemistry QC Analyst) | Chemistry Quality Control Technician (Chemistry QC Technician) | Data Quality Analyst | IT Quality Control Analyst (Information Technology Quality Control Analyst) | Lab Analyst | Lab Technician (Lab Tech) | Laboratory Analyst | Laboratory Technician (Lab Tech),mathematics | computers and electronics | telecommunications | engineering and technology,microsoft excel | sap software | adobe acrobat | atlassian jira | c | extensible markup language xml | hypertext markup language html | javascript
19-4099.03,Remote Sensing Technicians,remote sensing technicians,,43,4,15,Commercial Drone Operator | Commercial Drone Pilot | Commercial Drone Technician | Digital Cartographic Technician | Document Image Technician | Drone Operator | Drone Pilot | Drone Technician,computers and electronics | mathematics | engineering and technology | telecommunications,c | c++ | esri arcgis software | microsoft excel | python | r | the mathworks matlab | adobe creative cloud software
19-5011.00,Occupational Health and Safety Specialists,occupational health and safety specialists,,72,4,15,Analysis Safety Inspector | Cause Analyst | Certified Indoor Environmentalist | Certified Industrial Hygienist (CIH) | Chemical Hygiene Officer | Construction Safety Manager | Consumer Safety Inspector | Dining Service Inspector,mathematics | engineering and technology | computers and electronics | telecommunications,microsoft excel | microsoft access | microsoft active server pages asp | microsoft project | microsoft sharepoint | microsoft windows | sap software | curtis management resources training management system
19-5012.00,Occupational Health and Safety Technicians,occupational health and safety technicians,,35,4,15,"Advisory Industrial Hygienist | Certified Industrial Hygienist (CIH) | Construction Health and Safety Technician (CHST) | Construction Safety Consultant | Consumer Safety Technician (Consumer Safety Tech) | EHS Advisor (Environmental, Health, and Safety Advisor) | EHS Coordinator (Environmental Health and Safety Coordinator) | Environmental Health Technologist",engineering and technology | mathematics | computers and electronics | telecommunications,microsoft excel | microsoft access | microsoft sharepoint | sap software | brady lockout pro | database software | email software | graphics software
21-1011.00,Substance Abuse and Behavioral Disorder Counselors,substance abuse and behavioral disorder counselors,,57,4,15,Addiction Counselor | Addiction Recovery Specialist | Addiction Therapist | Addictions Counselor | Alcohol and Drug Counselor | Alcoholic Counselor | Alcoholism and Substance Abuse Counselor | Assessment Specialist,computers and electronics | mathematics | telecommunications | engineering and technology,microsoft excel | acms casewatch millenium | addison health systems writepad ehr | allscripts canopy | anasazi software assessment and treatment plan systems | athena software penelope case management | cadence solutions extendedreach | case management software
21-1012.00,"Educational, Guidance, and Career Counselors and Advisors",educational guidance and career counselors and advisors,,78,4,15,Academic Advisor | Academic Counselor | Admissions Counselor | Adult School Counselor | Advisor | Articulation Officer | Assessment Specialist | Career Advisor,computers and electronics | mathematics | telecommunications | engineering and technology,microsoft excel | adobe photoshop | facebook | google docs | microsoft access | microsoft project | microsoft sharepoint | microsoft sql server reporting services ssrs
21-1013.00,Marriage and Family Therapists,marriage and family therapists,,38,4,15,ABA Behavior Therapist (Applied Behavior Analysis Behavior Therapist) | Behavior Intervention Specialist | Behavior Specialist | Behavior Support Specialist | Behavior Technician (Behavior Tech) | Behavior Therapist | Behavioral Analyst | Behavioral Health Clinician,computers and electronics | telecommunications | mathematics | engineering and technology,intuit quickbooks | microsoft access | microsoft excel | microsoft teams | zoom | advantage software psych advantage | american medical billing software pma | anasazi software client data system
21-1014.00,Mental Health Counselors,mental health counselors,,36,4,15,BSS (Behavior Support Specialist) | Behavior Analyst | Behavioral Health Clinician | Behavioral Health Consultant | Behavioral Health Counselor | Behavioral Health Therapist | Bereavement Counselor | Case Manager,telecommunications | computers and electronics | mathematics | engineering and technology,microsoft access | microsoft excel | oracle peoplesoft | client information database systems | database software | email software | google classroom | management information systems mis
21-1015.00,Rehabilitation Counselors,rehabilitation counselors,,63,4,15,Blind Rehabilitation Specialist | Care Navigator | Career Navigator | Certified Rehabilitation Counselor | Classification Counselor | Client Navigator | Client Trainer | Counseling Psychologist,computers and electronics | mathematics | telecommunications | engineering and technology,microsoft excel | adobe acrobat reader | budgeting software | chart links | client information database software | data input software | electronic medical record emr software | email software
21-1019.00,"Counselors, All Other",counselors all other,,60,0,0,AIDS Counselor | Adoption Counselor | Anger Control Counselor | Behavior Specialist | Business Representative | Career Development Specialist | Career Manager | Career Specialist,,
21-1021.00,"Child, Family, and School Social Workers",child family and school social workers,,71,4,6,Adolescent Counselor | Adoption Agent | Adoption Coordinator | Adoption Counselor | Adoption Social Worker | Adoption Specialist | Adoption Worker | Case Manager,computers and electronics | mathematics | telecommunications | engineering and technology,microsoft excel | microsoft access | easycbm | patient electronic medical record emr software | student information systems sis software | web browser software
21-1022.00,Healthcare Social Workers,healthcare social workers,,53,4,15,AIDS Social Worker | Bereavement Counselor | Case Manager | Case Worker | Caseworker | Certified Health Care Social Worker | Certified Social Worker in Health Care (C-SWHC) | Client Advocate,computers and electronics | telecommunications | mathematics | engineering and technology,microsoft teams | zoom | meditech software | microsoft excel | google meet | adobe pagemaker | automated clinical information systems | calendar software
21-1023.00,Mental Health and Substance Abuse Social Workers,mental health and substance abuse social workers,,55,4,15,Addictions Counselor | Alcoholism Worker | Assessment Specialist | BHC (Behavioral Health Consultant) | Behavior Specialist | Behavioral Case Manager | Behavioral Clinician | Behavioral Health Care Manager (BHCM),computers and electronics | mathematics | telecommunications | engineering and technology,microsoft excel | adobe acrobat | microsoft sharepoint | adobe pagemaker | client records software | corel wordperfect office suite | database software | email software
21-1029.00,"Social Workers, All Other",social workers all other,,77,0,0,Adult Protective Services Social Worker | Case Consultant | Case Investigator | Case Manager | Case Reviewer | Case Supervisor | Case Worker | Children's Counselor,,
21-1091.00,Health Education Specialists,health education specialists,,51,4,15,BLS Instructor (Basic Life Support Instructor) | Behavioral Health Educator | Breastfeeding Educator | Breastfeeding Peer Counselor | CPR Instructor (Cardiopulmonary Resuscitation Instructor) | CPR and First Aid Instructor (Cardiopulmonary Resuscitation and First Aid Instructor) | Certified Breastfeeding Educator (CBE) | Certified Diabetes Educator,mathematics | computers and electronics | telecommunications | engineering and technology,microsoft excel | adobe photoshop | facebook | meditech software | microsoft access | microsoft visio | blackbaud the raiser s edge | blackboard software
21-1092.00,Probation Officers and Correctional Treatment Specialists,probation officers and correctional treatment specialists,,55,4,15,Adult Probation Officer | Adult Probation and Parole Officer | Attendance Officer | Community Corrections Specialist | Community Supervision Officer | Correctional Case Manager | Correctional Casework Specialist | Correctional Counselor,computers and electronics | mathematics | telecommunications | engineering and technology,microsoft excel | facebook | microsoft access | appointment scheduling software | case management software | corel wordperfect office suite | court records databases | customer relationship management crm software
21-1093.00,Social and Human Service Assistants,social and human service assistants,,59,4,9,Addictions Counselor Assistant | Advocate | Case Aide | Case Management Assistant | Case Management Coordinator | Case Work Aide | Certified Peer Specialist | Child Advocate,computers and electronics | mathematics | telecommunications | engineering and technology,meditech software | microsoft access | microsoft excel | database software | electronic medical record emr software | nuance dragon naturallyspeaking | pointclickcare healthcare software | web browser software
21-1094.00,Community Health Workers,community health workers,,44,4,10,Apprise Counselor | Behavioral Health Advocate | Behavioral Health Worker (BHW) | Benefits Outreach Specialist | Community Development Coordinator | Community Health Advisor | Community Health Advocate | Community Health Agent,computers and electronics | mathematics | telecommunications | engineering and technology,microsoft excel | apple macos | google workspace software | microsoft access | zoom | client databases | electronic health record ehr software | microsoft publisher
21-1099.00,"Community and Social Service Specialists, All Other",community and social service specialists all other,,63,0,0,Activist | Business Representative | Case Investigator | Case Manager | Case Reviewer | Case Supervisor | Case Worker | Children's Counselor,,
