onet_soc_code,canonical_title,normalized_canonical_title,matched_target_families,alternate_title_count,knowledge_count,technology_example_count,sample_alternate_titles,sample_top_knowledge,sample_top_technology_examples
47-2081.00,Drywall and Ceiling Tile Installers,drywall and ceiling tile installers,,51,4,8,Acoustical Carpenter | Acoustical Ceiling Installer | Acoustical Consultant | Acoustical Installer | Acoustical Specialist | Ceiling Installer | Dry Wall Installer | Drywall Application Specialist,mathematics | engineering and technology | computers and electronics | telecommunications,microsoft windows | business management software | construction software center easyest | devwave estimate works | job costing software | on center quick bid | turtle creek software goldenseal | wilhelm publishing threshold
47-2082.00,Tapers,tapers,,8,4,7,Drywall Finisher | Drywall Mechanic | Drywall Taper | Finisher | Sheet Rock Taper | Spackler | Taper | Wall Taper,mathematics | engineering and technology | telecommunications | computers and electronics,intuit quickbooks | applied computer systems jobpower | construction software center easyest | devwave estimate works | microsoft dynamics | on center quick bid | turtle creek software goldenseal
47-2111.00,Electricians,electricians,,89,4,15,Airport Electrician | Antenna Installer | Antenna Rigger | Commercial Electrician | Conduit Installer | Conduit Mechanic | Construction Electrician | Control Electrician,mathematics | telecommunications | engineering and technology | computers and electronics,adobe acrobat | autodesk autocad | microsoft excel | microsoft windows | sap software | aveva intouch hmi | computer aided design cad software | construction master pro
47-2121.00,Glaziers,glaziers,,37,4,6,Architectural Glazier | Art Glass Setter | Auto Glass Tech (Automobile Glass Technician) | Commercial Glazier | Field Glazier | Glass Fitter | Glass Glazier | Glass Inserter,mathematics | engineering and technology | computers and electronics | telecommunications,microsoft excel | microsoft windows | american glazing software ags windowpricer | bidmaster | d-calc facade 4000 | work order software
47-2131.00,"Insulation Workers, Floor, Ceiling, and Wall",insulation workers floor ceiling and wall,,43,4,6,Air Conditioning Insulation Installer | Attic Blower | Blower Insulator | Ceiling Insulation Blower | Composition Weatherboard Installer | Construction Insulation Installer | Containment Worker | Cork Insulation Installer,mathematics | engineering and technology | computers and electronics | telecommunications,microsoft excel | microsoft windows | cmsn fieldpak | comput-ability mechanical insulation key estimator | north american insulation manufacturers association naima 3e plus | turtle creek software goldenseal
47-2132.00,"Insulation Workers, Mechanical",insulation workers mechanical,,26,4,5,AC Insulation Installer (Air Conditioning Insulation Installer) | Blanket Maker | Boiler Coverer | Commercial Insulator | Duct Insulator | Firestopper Installer | Firestopper Technician (Firestopper Tech) | Heat and Frost Insulator,mathematics | engineering and technology | computers and electronics | telecommunications,cmsn fieldpak | comput-ability mechanical insulation key estimator | ibm maximo asset management | north american insulation manufacturers association naima 3e plus | turtle creek software goldenseal
47-2141.00,"Painters, Construction and Maintenance",painters construction and maintenance,,43,4,12,Architectural Coating Finisher | Bitumastic Applier | Bridge Painter | Brush Painter | Building Painter | Building Trades Painter | Calciminer | Caulker,mathematics | engineering and technology | telecommunications | computers and electronics,microsoft excel | microsoft windows | act | corel paint shop pro | corel painter | evergreen technology eagle bid estimating | evergreen technology total faux | insight direct serviceceo
47-2142.00,Paperhangers,paperhangers,,23,4,9,Advertising Installer | Advertising Poster | Bill Board Poster | Bill Poster | Bill Poster Installer | Billboard Poster | Graphics Installer | Hanger,mathematics | engineering and technology | computers and electronics | telecommunications,google docs | microsoft excel | a-systems jobview | construction software center easyest | corel painter | electronic data interchange edi software | on center quick bid | planswift
47-2151.00,Pipelayers,pipelayers,,30,4,3,Cast Iron Drain Pipe Layer | Drain Layer | Drain Tiler | Pipe Assembly Worker | Pipe Caulker | Pipe Connector | Pipe Cutter | Pipe Fitter,engineering and technology | mathematics | computers and electronics | telecommunications,microsoft excel | spreadsheet software | word processing software
47-2152.00,"Plumbers, Pipefitters, and Steamfitters",plumbers pipefitters and steamfitters,,84,4,15,Aircraft Hydraulic Equipment Mechanic | Aircraft Hydraulic Mechanic | Aircraft Plumbing Mechanic | Commercial Plumber | Corrosion Control Fitter | Diesel Engine Pipefitter | Drain Cleaner | Drain Technician,mathematics | engineering and technology | computers and electronics | telecommunications,intuit quickbooks | microsoft active server pages asp | microsoft excel | aec design group cadpipe | atlas construction business forms | autodesk building systems | bentley systems autopipe | bookkeeping software
47-2152.04,Solar Thermal Installers and Technicians,solar thermal installers and technicians,,19,4,15,Heat Exchanger | Installer | Solar Boilers Technician | Solar Energy Technician | Solar Hot Water Installer (SHW Installer) | Solar Installation Technician | Solar Installer | Solar Insulation Technician,engineering and technology | computers and electronics | mathematics | telecommunications,adobe photoshop | autodesk autocad | dassault systemes solidworks | microsoft excel | microsoft visual basic for applications vba | oracle java | salesforce software | 1cadcam unigraphics
47-2161.00,Plasterers and Stucco Masons,plasterers and stucco masons,,24,4,15,Applicator | Artisan | Artisan Plasterer | Decorative Plasterer | Dry Plasterer | Hard Surface Plasterer | Mason | Mason Plasterer,mathematics | engineering and technology | computers and electronics | telecommunications,linux | microsoft excel | oracle database | salesforce software | a-systems jobview | accounting software | autodesk 3ds max design | autodesk maya
47-2171.00,Reinforcing Iron and Rebar Workers,reinforcing iron and rebar workers,,29,4,6,Concrete Buster | Concrete Rod Buster | Concrete Worker | Field Ironworker | Iron Installer | Iron Worker | Ironworker | Ironworker Welder,mathematics | engineering and technology | computers and electronics | telecommunications,application software shear | applied systems associates asa rebar | otp armacad | rebarwin | spreadsheet software | word processing software
47-2181.00,Roofers,roofers,,39,4,15,Aluminum Shingle Roofer | Asbestos Shingle Roofer | Commercial Roofer | Commercial Roofing Tech (Commercial Roofing Technician) | Composition Roofer | Cool Roofing Installer | Gravel Roofer | Gutter Installer,mathematics | engineering and technology | computers and electronics | telecommunications,microsoft excel | microsoft windows | applicad roof wizard | asr software lwc-plus | asr software taper-plus | asr software topview le | asr software topview me | cadafis
47-2211.00,Sheet Metal Workers,sheet metal workers,,66,4,15,AC Sheet Metal Installer (Air Conditioning Sheet Metal Installer) | Air Duct Mechanic | Aircraft Metalsmith | Aircraft Sheet Metal Mechanic | Angle Bender | Aviation Metalsmith | Beam Worker | Ceiling Installer,mathematics | engineering and technology | computers and electronics | telecommunications,autodesk autocad | microsoft excel | microsoft windows | applied production profab | applied production profold | computer aided design cad software | computer aided manufacturing cam software | corte certo
47-2221.00,Structural Iron and Steel Workers,structural iron and steel workers,,72,4,5,Assembler | Awnings Mechanic | Billboard Erector | Billboard Installer | Billboard Mechanic | Bolter | Bridge Ironworker | Bridge Maintainer,mathematics | engineering and technology | telecommunications | computers and electronics,computer aided design cad software | cost estimating software | inventory tracking software | project scheduling software | turtle creek software goldenseal
47-2231.00,Solar Photovoltaic Installers,solar photovoltaic installers,,30,4,7,Electro-Mechanical Solar Technician (Electro-Mechanical Solar Tech) | Installation Technician (Installation Tech) | Installer | Journeyman Electrician PV Installer (Journeyman Electrician Photovoltaic Installer) | PV Fabrication Technician (Photovoltaic Fabrication Technician) | PV Fabrication and Testing Technician (Photovoltaic Fabrication and Testing Technician) | PV Installation Tech (Photovoltaic Installation Technician) | PV Installer (Photovoltaic Installer),engineering and technology | mathematics | computers and electronics | telecommunications,microsoft excel | extensible markup language xml | salesforce software | computer aided design cad software | cost estimating software | project management software | work scheduling software
47-3011.00,"Helpers--Brickmasons, Blockmasons, Stonemasons, and Tile and Marble Setters",helpers--brickmasons blockmasons stonemasons and tile and marble setters,,33,4,15,Adobe Layer Helper | Boat Joiner Helper | Boring Machine Operator Helper | Brick Carrier | Brick Cleaner | Brick Mason Helper | Brick Tender | Brick Washer,mathematics | engineering and technology | telecommunications | computers and electronics,autodesk revit | intuit quickbooks | microsoft access | microsoft excel | microsoft sharepoint | microsoft visio | accounting software | aya associates comp-u-floor
47-3012.00,Helpers--Carpenters,helpers--carpenters,,16,4,15,Beam Builder Helper | Building Carpenter Helper | Cabinetmaker Helper | Carpenter Assistant | Carpenter Helper | Carpenter Mate | Carpenter's Helper | Construction Carpenter's Helper,mathematics | telecommunications | engineering and technology | computers and electronics,intuit quickbooks | linux | microsoft access | microsoft excel | microsoft sharepoint | microsoft windows | oracle database | salesforce software
47-3013.00,Helpers--Electricians,helpers--electricians,,25,4,4,Apprentice | Automotive Electrician Helper (Auto Electrician Helper) | E and I Apprentice (Electrical and Instrumentation Apprentice) | E and I Apprentice (Electrician and Instrumentation Apprentice) | Electrical Apprentice | Electrical Assistant | Electrical Helper | Electrical Sign Wirer Helper,mathematics | engineering and technology | telecommunications | computers and electronics,microsoft excel | computer-aided drafting or design software | recordkeeping software | report generation software
47-3014.00,"Helpers--Painters, Paperhangers, Plasterers, and Stucco Masons",helpers--painters paperhangers plasterers and stucco masons,,24,4,10,Billboard Poster Helper | Bridge Painter Helper | Dry Plasterer Helper | Exterior Work Helper | Highway Painter Helper | House Painter Helper | Hydroblaster | Mason's Tender,mathematics | engineering and technology | computers and electronics | telecommunications,microsoft excel | a-systems jobview | apple iwork | construction software center easyest | cost estimating software | evergreen technology eagle bid estimating | on center quick bid | sage construction anywhere
47-3015.00,"Helpers--Pipelayers, Plumbers, Pipefitters, and Steamfitters",helpers--pipelayers plumbers pipefitters and steamfitters,,26,4,1,Conduit Helper | Gas Main Fitter Helper | Hydraulic Plumber Helper | Industrial Gas Fitter Helper | Journeyman Plumber | Marine Pipefitter Helper | Marine Steam Fitter Helper | Pipe Coverer Helper,mathematics | engineering and technology | computers and electronics | telecommunications,microsoft excel
47-3016.00,Helpers--Roofers,helpers--roofers,,13,4,11,Commercial Roofing Helper | Commercial Roofing Laborer | Hot Tar Roofer Helper | Industrial Roofer Helper | Residential Roofer Helper | Roofer Apprentice | Roofer Assistant | Roofer Helper,mathematics | telecommunications | engineering and technology | computers and electronics,applicad roof wizard | digitools roof cad | energy cost evaluation software | exele topview | humidity and vapor drive calculation software | insight direct serviceceo | maintenance record software | roof pro estimate software roof pro
47-3019.00,"Helpers, Construction Trades, All Other",helpers construction trades all other,,71,0,0,Asbestos Worker Helper | Awning Hanger Helper | Axman | Boiler Coverer Helper | Bridge Ironworker Helper | Carpet Layer Helper | Carpet or Rug Layer Helper | Cellulose Insulation Helper,,
47-4011.00,Construction and Building Inspectors,construction and building inspectors,,63,4,15,Amusement Ride Inspector | Architectural Examiner | Architectural Inspector | Boiler Inspector | Bridge Inspector | Building Code Administrator | Building Code Inspector | Building Equipment Inspector,mathematics | computers and electronics | engineering and technology | telecommunications,microsoft excel | autodesk autocad | intuit quickbooks | microsoft project | oracle primavera enterprise project portfolio management | sap software | arc second pocketcad | automated permit system software
47-4011.01,Energy Auditors,energy auditors,,31,4,15,Building Performance Consultant | Building Science and Energy Specialist | Building Scientist | Commercial Energy Auditor | Commercial Energy Rater | Energy Advisor | Energy Analyst | Energy Audit Advisor,mathematics | engineering and technology | computers and electronics | telecommunications,microsoft excel | python | r | sas | structured query language sql | adobe photoshop | autodesk autocad | c++
47-4021.00,Elevator and Escalator Installers and Repairers,elevator and escalator installers and repairers,,31,4,6,Accessibility Lift Technician (Accessibility Lift Tech) | Accessibility and Private Residence Lift Technician (Accessibility and Private Residence Lift Tech) | Building Serviceman | Contract Serviceman | Elevator Adjuster | Elevator Builder | Elevator Constructor | Elevator Erector,computers and electronics | mathematics | engineering and technology | telecommunications,microsoft excel | computerized maintenance management system cmms | elevator controls interact | scheduling software | troubleshooting software | world electronics freedomware
47-4031.00,Fence Erectors,fence erectors,,16,4,6,Chain Link Fence Installer | Fence Builder | Fence Contractor | Fence Erector | Fence Installer | Fence Laborer | Fence Mechanic | Fence Repairman,mathematics | engineering and technology | computers and electronics | telecommunications,autodesk autocad | facebook | microsoft excel | cutlist plus fx | maxwell systems american contractor | software design associates computer fencing system cfs
47-4041.00,Hazardous Materials Removal Workers,hazardous materials removal workers,,34,4,11,Abatement Worker | Asbestos Abatement Worker | Asbestos Coverer | Asbestos Handler | Asbestos Hazard Abatement Worker | Asbestos Remover | Asbestos Technician | Asbestos Worker,mathematics | engineering and technology | telecommunications | computers and electronics,jenkins ci | microsoft excel | sap software | computerized maintenance management system software cmms | database software | internet browser software | inventory management systems | presentation software
47-4051.00,Highway Maintenance Workers,highway maintenance workers,,47,4,5,Asphalt Raker | Caltrans Equipment Operator | Certified Flagger | Construction Flagger | Equipment Operator (EO) | Flagger | Highway Maintainer | Highway Maintenance Crew Worker,engineering and technology | mathematics | telecommunications | computers and electronics,microsoft excel | database software | spreadsheet software | web browser software | word processing software
47-4061.00,Rail-Track Laying and Maintenance Equipment Operators,rail-track laying and maintenance equipment operators,,40,4,3,Ballast Cleaning Machine Operator | Emergency Service Restorer | Machine Operator | Maintenance Laborer | Oil Distributor Tender | Portable Grinding Machine Operator | Rail Maintenance Worker | Rail Track Layer,engineering and technology | mathematics | telecommunications | computers and electronics,microsoft excel | enterprise resource planning erp software | timekeeping software
47-4071.00,Septic Tank Servicers and Sewer Pipe Cleaners,septic tank servicers and sewer pipe cleaners,,27,4,6,Aseptic Tech (Aseptic Technician) | Drain Cleaner | Drain Technician | Drain and Sewer Technician | Electric Sewer Cleaning Machine Operator | High Reach Operator | Pipe Cleaning Machine Operator | Priming Machine Operator,mathematics | engineering and technology | computers and electronics | telecommunications,intuit quickbooks | microsoft excel | route mapping software | web browser software | word processing software | work scheduling software
47-4091.00,Segmental Pavers,segmental pavers,,30,4,8,Asphalt Foreman | Asphalt Laborer | Asphalt Paver Operator | Asphalt Paving Coordinator | Asphalt Paving Crew Member | Asphalt Paving Laborer | Asphalt Paving Worker | Asphalt Plant Laborer,engineering and technology | mathematics | telecommunications | computers and electronics,microsoft excel | database software | decorative software online visualizers | depiction software deco-con | depiction software deco-con estimator | depiction software hardscape imaging | uni-group lockpave pro | web browser software
47-4099.00,"Construction and Related Workers, All Other",construction and related workers all other,,89,0,0,Aluminum Pool Installer | Architectural and Ornamental Ironworker | Asphalt Dauber | Asphalt Heater Operator | Asphalt Heater Tender | Awning Erector | Awning Hanger | Awning Installer,,
47-4099.03,Weatherization Installers and Technicians,weatherization installers and technicians,,19,4,11,Air Sealing Technician | Building Energy Retrofit Technician | Compounding Technician | Energy Administrator | Field Technician | Field Weatherization Specialist | Glass Sealing Technician | Home Weatherizing Worker,mathematics | computers and electronics | engineering and technology | telecommunications,microsoft excel | microsoft access | microsoft project | microsoft windows | sap software | database software | energy auditing software | energy use ratings databases
47-5011.00,"Derrick Operators, Oil and Gas",derrick operators oil and gas,,12,4,1,Derrick Hand | Derrick Man | Derrick Operator | Derrick Worker | Driller | Drilling Motorman | Floor Hand | Fracturing Derrick Operator,mathematics | engineering and technology | computers and electronics | telecommunications,microsoft excel
47-5012.00,"Rotary Drill Operators, Oil and Gas",rotary drill operators oil and gas,,40,4,10,Blast Driller | Cable Driller | Cable Tool Driller | Cable Tool Operator | Clean Out Driller | Core Drill Operator | Core Driller | Daylight Driller,mathematics | engineering and technology | computers and electronics | telecommunications,microsoft excel | python | salesforce software | sap software | capsher technology suretec | drillingsoftware drillpro | drillingsoftware tubular database | pason wellview field solution
47-5013.00,"Service Unit Operators, Oil and Gas",service unit operators oil and gas,,30,4,8,Coiled Tubing Operator | Fishing Tool Operator | Gather Operator | Oil Processing Technician | Oil Well Fishing Tool Technician | Oil Well Service Operator | Oil Well Service Unit Operator | Oil and Gas Equipment Operator,mathematics | engineering and technology | computers and electronics | telecommunications,microsoft excel | microsoft sharepoint | sap software | computerized maintenance management system cmms | data logger software | inventory tracking software | supervisory control and data acquisition scada software | time and attendance software
47-5022.00,"Excavating and Loading Machine and Dragline Operators, Surface Mining",excavating and loading machine and dragline operators surface mining,,64,4,8,Aerial Tram Operator | Air Shovel Operator | Back Digger Operator | Back Filler Operator | Back Hoe Machine Operator | Back Hoe Operator | Backhoe Operator | Clam Shovel Operator,mathematics | engineering and technology | computers and electronics | telecommunications,microsoft excel | microsoft windows | email software | google gmail | machine control systems | machine monitoring software | spreadsheet software | word processing software
47-5023.00,"Earth Drillers, Except Oil and Gas",earth drillers except oil and gas,,64,4,2,Auger Operator | Blast Driller | Blast Hole Driller | Boring Machine Operator | Churn Drill Operator | Churn Driller | Construction Driller | Construction Well Drill Operator,mathematics | engineering and technology | telecommunications | computers and electronics,microsoft excel | global positioning system gps software
47-5032.00,"Explosives Workers, Ordnance Handling Experts, and Blasters",explosives workers ordnance handling experts and blasters,,109,4,6,Aircraft Ordnance Technician | Ammunition and Explosives Handler | Blast Driller | Blast Hole Driller | Blast Setter | Blast Technician | Blaster | Blasting Clay Miner,mathematics | engineering and technology | computers and electronics | telecommunications,autodesk autocad | esri arcgis software | microsoft excel | datavis dbs designer | detnet viewshot | global positioning system gps software
47-5041.00,Continuous Mining Machine Operators,continuous mining machine operators,,35,4,6,Bore Miner Operator | Bulldozer Operator | Concrete Crusher Loader Operator | Continuous Miner | Continuous Miner Operator (CMO) | Continuous Mining Machine Coal Miner | Continuous Mining Machine Company Miner | Continuous Mining Machine Contract Miner,engineering and technology | mathematics | telecommunications | computers and electronics,microsoft excel | fleet monitoring system software | hitachi zxlink | leica geosystems fms | minitab | word processing software
47-5043.00,"Roof Bolters, Mining",roof bolters mining,,14,4,2,Bolt Machine Operator | Bolt Man | Bolter | Bolting Inspector | Bolting Machine Operator | Miner | Place Change Roof Bolter | Roof Bolter,engineering and technology | mathematics | computers and electronics | telecommunications,caterpillar cat minestar system | caterpillar command
47-5044.00,"Loading and Moving Machine Operators, Underground Mining",loading and moving machine operators underground mining,,46,4,7,Buggy Driver | Buggy Man | Buggy Operator | Buggy Runner | Car Dropper | Car Dumper | Car Pincher | Cart Driver,engineering and technology | mathematics | telecommunications | computers and electronics,microsoft excel | microsoft windows | automated systems software | inventory management systems | maintenance management software | mine maintenance software | work time accounting software
47-5049.00,"Underground Mining Machine Operators, All Other",underground mining machine operators all other,,53,0,0,Belt Operator | Clay Mine Cutting Machine Operator | Coal Miner | Coal Trimmer Machine Operator | Copper Miner | Digging Machine Operator | Drilling Machine Operator | Dry Placer Machine Operator,,
47-5051.00,"Rock Splitters, Quarry",rock splitters quarry,,14,4,9,Driller | Quarry Chop Saw Operator | Quarry Driller | Quarry Plug and Feather Driller | Quarry Worker | Quarrying Specialist | Rock Breaker | Rock Picker,mathematics | computers and electronics | engineering and technology | telecommunications,autodesk autocad | facebook | microsoft excel | microsoft project | sap software | apache http server | maintenance reporting software | minitab
47-5071.00,"Roustabouts, Oil and Gas",roustabouts oil and gas,,38,4,15,Casing Crew Pusher | Cathead Operator | Connection Worker | Derrick Hand | Drill Rig Operator | Dumper Bailer Operator | Equipment Operator | Field Service Engineer,mathematics | engineering and technology | computers and electronics | telecommunications,microsoft access | microsoft excel | microsoft windows | sap software | database management systems | enertia | inventory management systems | maintenance record software
47-5081.00,Helpers--Extraction Workers,helpers--extraction workers,,59,4,3,Blaster Helper | Blasting Helper | Boring Machine Operator Helper | Bottom Hole Pressure Recording Operator Helper | Churn Driller Helper | Clean Out Driller Helper | Clean-Out Driller Helper | Coal Loader,mathematics | engineering and technology | computers and electronics | telecommunications,google docs | microsoft excel | enterprise resource planning erp software
47-5099.00,"Extraction Workers, All Other",extraction workers all other,,133,0,0,Acidizer | Air Pumper | Back Hand | Bagger | Battery Charger | Battery Starter | Bog Cutter | Bog Worker,,
49-1011.00,"First-Line Supervisors of Mechanics, Installers, and Repairers",first-line supervisors of mechanics installers and repairers,,158,4,15,AC Installer Supervisor (Air-Conditioning Installer Supervisor) | AC Supervisor (Air Conditioning Supervisor) | Aircraft Maintenance Supervisor | Airport Maintenance Chief | Airport Skilled Maintenance Supervisor | Apartment Maintenance Supervisor | Appliance Service Supervisor | Artillery Maintenance Supervisor,mathematics | computers and electronics | engineering and technology | telecommunications,microsoft excel | autodesk autocad | microsoft access | microsoft project | microsoft sharepoint | microsoft windows | oracle primavera enterprise project portfolio management | sap software
