onet_soc_code,canonical_title,normalized_canonical_title,matched_target_families,alternate_title_count,knowledge_count,technology_example_count,sample_alternate_titles,sample_top_knowledge,sample_top_technology_examples
29-2032.00,Diagnostic Medical Sonographers,diagnostic medical sonographers,,33,4,10,Cardiac Sonographer | Cardiovascular Sonographer | Diagnostic Medical Sonographer | Echo Sonographer (Echocardiograph Sonographer) | Echo Tech (Echocardiographic Technician) | Echocardiogram Technician | Echocardiographer | Echocardiographic Technologist,computers and electronics | mathematics | telecommunications | engineering and technology,eclinicalworks ehr software | meditech software | microsoft excel | calendar and scheduling software | database software | email software | medical procedure coding software | patient medical record software
29-2033.00,Nuclear Medicine Technologists,nuclear medicine technologists,,16,4,6,Certified Nuclear Medicine Technologist (CNMT) | Isotope Technician | Isotope Technologist | Medical Radiation Dosimetrist | Nuclear Cardiology Technologist | Nuclear Medical Technologist | Nuclear Medicine PET-CT Technologist (Nuclear Medicine Positron Emission Tomography - Computed Tomography Technologist) | Nuclear Medicine Technician,computers and electronics | mathematics | engineering and technology | telecommunications,meditech software | microsoft excel | electronic medical record emr software | gamma camera software | medovation radrunner | radiopharmacy inventory databases
29-2034.00,Radiologic Technologists and Technicians,radiologic technologists and technicians,,55,4,15,3D Technologist | Angiogram Special Procedures Technologist | CAT Technologist (Computed Axial Tomography Technologist) | CT Radiology Technologist (Computerized Tomography Radiology Technologist) | CT Scan Special Procedures Technologist (Computed Tomography Scan Special Procedures Technologist) | CT Scan Tech (Computed Tomography Scan Technologist) | CT Scanner Operator (Computed Tomography Scanner Operator) | CT Tech (Computer Tomography Technician),computers and electronics | mathematics | telecommunications | engineering and technology,r | eclinicalworks ehr software | meditech software | microsoft excel | diagnostic and procedural coding software | diagnostic image review software | digital imaging communications in medicine dicom software / modality management software | electronic medical record emr software
29-2035.00,Magnetic Resonance Imaging Technologists,magnetic resonance imaging technologists,,10,4,10,Imaging Technologist | MRI Coordinator (Magnetic Resonance Imaging Coordinator) | MRI QA Coordinator (Magnetic Resonance Imaging Quality Assurance Coordinator) | MRI Radiographer (Magnetic Resonance Imaging Radiographer) | MRI Special Procedures Technologist (Magnetic Resonance Imaging Special Procedures Technologist) | MRI Specialist (Magnetic Resonance Imaging Specialist) | MRI Tech (Magnetic Resonance Imaging Technician) | MRI Technologist (Magnetic Resonance Imaging Technologist),computers and electronics | engineering and technology | mathematics | telecommunications,eclinicalworks ehr software | meditech software | microsoft excel | appointment scheduling software | electronic medical record emr software | ge healthcare centricity emr | medical image processing software | radiology information systems ris
29-2036.00,Medical Dosimetrists,medical dosimetrists,,8,4,4,CMD (Certified Medical Dosimetrist) | Dosimetrist | Medical Dosimetrist | Medical Physicist | Medical Radiation Dosimetrist | Radiation Dosimetrist | Radiation Oncology Medical Physicist | Radiation Therapy Dosimetrist (RT Dosimetrist),mathematics | computers and electronics | engineering and technology | telecommunications,eclipse ide | epic systems | meditech software | medical condition coding software
29-2042.00,Emergency Medical Technicians,emergency medical technicians,,25,0,15,Advanced Emergency Medical Technician (AEMT) | Ambulance Driver | Dispatcher | EMT Paramedic (Emergency Medical Technician Paramedic) | EMT-B (Emergency Medical Technician- Basic) | EMT-I/85 | EMT-I/99 | EMT-P,,meditech software | microsoft excel | epocrates | hypertox | informed ems field guide | iterum emedic | meddatasolutions regist r | medical wizards er and icu toolbox
29-2043.00,Paramedics,paramedics,,14,0,15,Critical Care Flight Paramedic | Critical Care Paramedic | ED Paramedic (Emergency Department Paramedic) | EMT (Emergency Medical Technician) | EMT Paramedic (Emergency Medical Technician Paramedic) | ER Paramedic (Emergency Room Paramedic) | First Responder | Flight Paramedic,,r | apple ios | eclinicalworks ehr software | meditech software | microsoft excel | epocrates | hypertox | informed ems field guide
29-2051.00,Dietetic Technicians,dietetic technicians,,36,4,15,Certified Dietary Manager (CDM) | Child Nutrition Assistant | Clinical Dietetic Technician | Cook Chill Technician (CCT) | Diet Aide | Diet Assistant | Diet Clerk | Diet Tech (Diet Technician),mathematics | computers and electronics | telecommunications | engineering and technology,meditech software | microsoft access | microsoft excel | appointment scheduling software | axxya systems nutritionist pro | cbord nutrition service suite | computrition nutrition care management ncm select | cybersoft nutribase
29-2052.00,Pharmacy Technicians,pharmacy technicians,,18,4,15,Accredited Pharmacy Technician | Certified Pharmacy Technician (CPhT) | Chemotherapy Pharmacy Technician (Chemo Pharmacy Technician) | Compounding Pharmacy Tech (Compounding Pharmacy Technician) | Compounding Technician | Drug Coordinator | Hospital Pharmacy Tech (Hospital Pharmacy Technician) | Inpatient Pharmacy Tech (Inpatient Pharmacy Technician),mathematics | computers and electronics | telecommunications | engineering and technology,microsoft excel | apple safari | meditech software | microsoft edge | mozilla firefox | billing and reimbursement software | compounder software | database software
29-2053.00,Psychiatric Technicians,psychiatric technicians,,24,4,10,Autism Behavior Technician (Autism Behavior Tech) | BHT (Behavioral Health Technician) | Behavior Technician (Behavior Tech) | Behavioral Health Associate | Behavioral Technician (Behavioral Tech) | Counselor | Health Care Technician (Health Care Tech) | LPT (Licensed Psychiatric Technician),computers and electronics | telecommunications | mathematics | engineering and technology,microsoft excel | adl data systems optimumclinicals electronic health record | allscripts sunrise | cerner profile | epic epiccare inpatient clinical system | ge healthcare centricity emr | icanotes | infologix healthtrax engine
29-2055.00,Surgical Technologists,surgical technologists,,17,4,15,Cardiovascular Operating Room Technologist (CVOR Technologist) | Certified Surgical Technician | Certified Surgical Technologist (CST) | Operating Room Surgical Technician (OR St) | Operating Room Surgical Technologist | Operating Room Technician (OR Tech) | Operating Room Technologist (OR Tech) | Scrub Technician,mathematics | computers and electronics | engineering and technology | telecommunications,meditech software | microsoft excel | microsoft windows | database software | electronic medical record emr software | email software | google drive | graphics software
29-2056.00,Veterinary Technologists and Technicians,veterinary technologists and technicians,,19,4,9,Animal Care Technician (Animal Care Tech) | Animal Health Technician (Animal Health Tech) | Animal Technician (Animal Tech) | Certified Veterinary Technician (CVT) | Emergency Veterinary Technician (Emergency Vet Tech) | Internal Medicine Veterinary Technician (Internal Medicine Vet Tech) | Licensed Veterinary Technician (LVT) | Registered Veterinary Technician (RVT),mathematics | computers and electronics | telecommunications | engineering and technology,microsoft access | microsoft excel | animal intelligence software animal intelligence | filemaker pro | mcallister software systems avimark | practice management software pms | veterinary practice management software pms | web browser software
29-2057.00,Ophthalmic Medical Technicians,ophthalmic medical technicians,,24,4,10,Certified Ophthalmic Medical Technician (Certified Ophthalmic Medical Tech) | Certified Ophthalmic Surgical Assistant | Certified Ophthalmic Technician (COT) | Certified Ophthalmic Technician-Surgical Assistant (COT-SA) | Certified Retinal Angiographer | Eyecare Advisor | Health Technician (Health Tech) | Medical Technician (Medical Tech),mathematics | computers and electronics | engineering and technology | telecommunications,microsoft excel | acuitypro | email software | eyemd emr healthcare systems eyemd emr | ezchartwriter | ichartplus | medflow complete | medipro medisoft clinical
29-2061.00,Licensed Practical and Licensed Vocational Nurses,licensed practical and licensed vocational nurses,,16,4,15,Charge Nurse | Clinic Licensed Practical Nurse (Clinic LPN) | Clinic Nurse | Home Health Licensed Practical Nurse (Home Health LPN) | Licensed Care Coordinator (LCC) | Licensed Practical Nurse (LPN) | Licensed Vocational Nurse (LVN) | Long Term Care LPN (Long Term Care Licensed Practical Nurse),mathematics | computers and electronics | telecommunications | engineering and technology,eclinicalworks ehr software | epic systems | meditech software | microsoft excel | microsoft windows | zoom | diagnostic and procedural coding software | electronic medical record emr software
29-2072.00,Medical Records Specialists,medical records specialists,,58,0,15,Certified Coding Specialist | Certified Medical Coder | Certified Professional Coder (CPC) | Clinical Documentation Specialist | Clinical Office Technician (Clinical Office Tech) | Coder | Coding Consultant | Coding Specialist,,epic systems | microsoft excel | eclinicalworks ehr software | henry schein dentrix | ibm spss statistics | meditech software | microsoft access | microsoft project
29-2081.00,"Opticians, Dispensing",opticians dispensing,,18,4,15,Certified Optician | Contact Lens Fitter | Contact Lens Technician | Dispensing Optician | Dispensing and Measuring Optician | Eyecare Advisor | Eyeglass Fitter | Eyewear Specialist,mathematics | computers and electronics | engineering and technology | telecommunications,intuit quickbooks | microsoft excel | compulink eyecare advantage | cygnet infotech optifocus | database software | diversified ophthalmics practice maximus | emrlogic systems enterprise visions | ez-zone optizone enterprise
29-2091.00,Orthotists and Prosthetists,orthotists and prosthetists,,28,4,15,American Board Certified Orthotist (ABC Orthotist) | Artificial Limb Fitter | Board Orthotist | Board Prosthetist | Certified Orthotic Fitter | Certified Orthotist (CO) | Certified Pedorthist | Certified Prosthetist (CP),engineering and technology | computers and electronics | mathematics | telecommunications,autodesk autocad | intuit quickbooks | microsoft access | microsoft excel | alibre design | american orthotic and prosthetic association codingpro | artsco orthopro complete | computer aided manufacturing cam software
29-2092.00,Hearing Aid Specialists,hearing aid specialists,,24,4,3,Audiology Assistant | Audiology Technician | Audioprosthologist | Board Certified Hearing Instrument Specialist (Board Certified HIS) | Hearing Aid Attendant | Hearing Aid Consultant | Hearing Aid Dispenser | Hearing Aid Fitter,computers and electronics | engineering and technology | mathematics | telecommunications,microsoft excel | himsa noah | otometrics otosuite
29-2099.00,"Health Technologists and Technicians, All Other",health technologists and technicians all other,,51,0,0,Audiometrist | Brain Wave Technician | Central Supply Technician | Cephalometric Analyst | Certified Medical Technician (CMT) | Certified Respiratory Therapy Technician (CRTT) | Child Health Associate | Closed Circuit Screen Watcher,,
29-2099.01,Neurodiagnostic Technologists,neurodiagnostic technologists,,32,4,15,Cardiovascular Operating Room Technologist (CVOR Technologist) | Certified Intraoperative Neurophysiology Technologist (Certified Intraoperative Neurophysiology Tech) | Certified Neurodiagnostic Technologist | EEG Tech (Electroencephalogram Technician) | EEG Technologist (Electroencephalograph Technologist) | EP Technologist (Electrophysiology Technologist) | Electroencephalogram Technologist (EEG Technologist) | Electroencephalograph Technician (EEG Tech),computers and electronics | mathematics | engineering and technology | telecommunications,r | javascript | meditech software | microsoft excel | microsoft windows | besa eegfocus | cadwell laboratories easy | database software
29-2099.05,Ophthalmic Medical Technologists,ophthalmic medical technologists,,21,4,15,Angiographer | Angiography Technologist | Certified Diagnostic Ophthalmic Sonographer (CDOS) | Certified Ophthalmic Medical Technologist (COMT) | Certified Ophthalmic Technologist | Certified Retinal Angiographer | Medical Technologist | Ocular Care Technologist,mathematics | computers and electronics | telecommunications | engineering and technology,autodesk autocad | javascript | microsoft excel | sap software | acuitypro | computer aided design and drafting cadd software | email software | eyemd emr healthcare systems eyemd emr
29-2099.08,Patient Representatives,patient representatives,,38,4,15,Access Representative | Admissions Coordinator | Admitting Clerk | Admitting Representative | Care Navigator | Case Manager | Clinical Liaison | Healthcare Registrar,computers and electronics | telecommunications | mathematics | engineering and technology,epic systems | microsoft excel | eclinicalworks ehr software | google docs | henry schein dentrix | meditech software | microsoft access | microsoft windows
29-9021.00,Health Information Technologists and Medical Registrars,health information technologists and medical registrars,analytics,33,0,15,Applications Analyst | Cancer Registrar | Cancer Tumor Registrar | Certified Cancer Registrar | Certified Tumor Registrar (CTR) | Clinical Analyst | Clinical Data Specialist | Clinical Documentation Improvement Specialist (CDIS),,epic systems | microsoft excel | eclinicalworks ehr software | henry schein dentrix | ibm spss statistics | meditech software | microsoft access | microsoft project
29-9091.00,Athletic Trainers,athletic trainers,,17,4,13,Athletic Instructor | Athletic Lecturer | Athletic Trainer | Certified Athletic Trainer | Clinical Athletic Instructor | Clinical Athletic Trainer | Fitness Specialist | Licensed Athletic Trainer,computers and electronics | mathematics | engineering and technology | telecommunications,microsoft excel | bioex systems exercise pro | database software | digital coach athletictrainer | email software | impact applications impact | injury tracking software | keffer development services athletic trainer system ats
29-9092.00,Genetic Counselors,genetic counselors,,15,4,15,Cancer Genetic Counselor | Cancer Program Consultant | Certified Genetic Counselor | Chromosomal Disorders Counselor | Clinical Reviewer | Genetic Coordinator | Genetic Counseling Medical Specialist | Genetic Counselor,mathematics | computers and electronics | telecommunications | engineering and technology,microsoft excel | microsoft access | benetech pra | brcapro | breast cancer risk assessment tool | cancergene | cyrillicsoftware cyrillic | database software
29-9093.00,Surgical Assistants,surgical assistants,,29,4,9,Certified First Assistant (CFA) | Certified Nursing Assistant (CNA) | Certified Registered Nurse First Assistant (CRNFA) | Certified Surgical Assistant (CSA) | Certified Surgical First Assistant (CSFA) | Certified Surgical Technician | Clinical Assistant | First Assistant,computers and electronics | mathematics | engineering and technology | telecommunications,meditech software | microsoft excel | electronic medical record emr software | nursing documentation software | patient scheduling software | patient tracking software | supply documentation software | surgery workflow communication software
29-9099.00,"Healthcare Practitioners and Technical Workers, All Other",healthcare practitioners and technical workers all other,,12,0,0,Central Supply Technician | Child Health Associate | Drug Coordinator | Extracorporeal Technician | Health Service Coordinator | Kinesiologist | Medical Consultant | Pheresis Specialist,,
29-9099.01,Midwives,midwives,,16,4,10,APC (Advanced Practice Clinician) | APP (Advanced Practice Provider) | Birth Center Midwife | Birth Doula | Certified Direct-Entry Midwife | Certified Midwife | Certified Professional Midwife (CPM) | Direct-Entry Midwife,computers and electronics | mathematics | telecommunications | engineering and technology,epic systems | extensible markup language xml | meditech software | microsoft excel | as / 400 database | email software | enterprise resource planning erp software | patient electronic medical record emr software
31-1121.00,Home Health Aides,home health aides,,42,4,15,Care Worker | Caregiver | Certified Home Health Aide (CHHA) | Certified Medical Aide (CMA) | Certified Nurses Aide (CNA) | Companion | Day Support Professional | Digital Health Caregiver,telecommunications | computers and electronics | mathematics | engineering and technology,linux | microsoft access | microsoft excel | microsoft sharepoint | microsoft windows | oracle database | python | salesforce software
31-1122.00,Personal Care Aides,personal care aides,,44,4,10,Aide | Blind Aide | Blind Escort | Care Caregiver | Care Companion | Care Provider | Caregiver | Caretaker,computers and electronics | mathematics | engineering and technology | telecommunications,meditech software | appletree | august systems visit wizard | computer reading software | email software | facetime | mi-co mi-forms | spreadsheet software
31-1131.00,Nursing Assistants,nursing assistants,,51,4,15,Birth Attendant | Certified Medication Aide (CMA) | Certified Nurse Aide (CNA) | Certified Nurse Assistant (CNA) | Certified Nurses Aide (CNA) | Certified Nursing Assistant (CNA) | Certified Nursing Attendant (CNA) | Certified Residential Medication Aide (CRMA),mathematics | computers and electronics | telecommunications | engineering and technology,apache spark | epic systems | meditech software | microsoft excel | billing software | facetime | ge healthcare centricity emr | health information database software
31-1132.00,Orderlies,orderlies,,42,4,5,Attendant | Cart Attendant | Clinical Support Associate | Emergency Room Orderly | Hospice Entrance Attendant | Hospital Corpsman | Hospital Orderly | Infirmary Attendant,telecommunications | computers and electronics | mathematics | engineering and technology,microsoft excel | microsoft windows | electronic medical record emr software | ge healthcare centricity emr | medical record charting software
31-1133.00,Psychiatric Aides,psychiatric aides,,32,4,4,BHA (Behavioral Health Aide) | BHA (Behavioral Health Associate) | Behavior Aide | Behavior Assistant | Behavior Intervention Assistant | Behavior Support Assistant | Behavioral Aide | Behavioral Assistant,computers and electronics | mathematics | telecommunications | engineering and technology,microsoft excel | microsoft windows | email software | patient management software
31-2011.00,Occupational Therapy Assistants,occupational therapy assistants,,21,4,15,Acute Care Occupational Therapy Assistant (Acute Care OT Assistant) | Certified Occupational Assistant | Certified Occupational Therapist Assistant (COTA) | Certified Occupational Therapy Assistant (COTA) | Certified Travel OTA (Certified Travel Occupational Therapist Assistant) | Home Health COTA (Home Health Certified Occupational Therapy Assistant) | Independent Living Specialist | Licensed Occupational Therapist Assistant (LOTA),computers and electronics | engineering and technology | mathematics | telecommunications,eclinicalworks ehr software | facebook | microsoft access | microsoft excel | microsoft windows | accounting software | billing software | bookkeeping software
31-2012.00,Occupational Therapy Aides,occupational therapy aides,,16,4,7,Certified Occupational Rehabilitation Aide (CORA) | Direct Service Professional (DSP) | Direct Support Professional (DSP) | Independent Living Specialist | Occupational Rehabilitation Aide | Occupational Therapist Aide (OT Aide) | Occupational Therapy Aide (OT Aide) | Rehabilitation Aide (Rehab Aide),computers and electronics | mathematics | telecommunications | engineering and technology,meditech software | microsoft access | microsoft excel | billing software | electronic medical record emr software | scheduling software | word processing software
31-2021.00,Physical Therapist Assistants,physical therapist assistants,,15,4,15,Assistant | Certified Physical Therapist Assistant (CPTA) | Home Care Physical Therapy Assistant | Home Health Physical Therapist Assistant | Home Health Physical Therapy Assistant (Home Health PTA) | Licensed Physical Therapist Assistant (LPTA) | Licensed Physical Therapy Assistant | Nursing Facility PTA (Nursing Facility Physical Therapy Assistant),computers and electronics | mathematics | engineering and technology | telecommunications,eclinicalworks ehr software | microsoft access | microsoft excel | microsoft windows | accounting software | arena health systems phys-x | beaver creek software the therapist | billing software
31-2022.00,Physical Therapist Aides,physical therapist aides,,15,4,7,Aide | Outpatient Aide | Outpatient Therapy Aide | PT Attendant (Physical Therapy Attendant) | PT Tech (Physical Therapist Technician) | PT Tech (Physical Therapy Technician) | Physical Therapist Aide (PTA) | Physical Therapy Aide (PTA),computers and electronics | telecommunications | mathematics | engineering and technology,epic systems | meditech software | microsoft excel | medical procedure coding software | patient record maintenance software | scheduling software | word processing software
31-9011.00,Massage Therapists,massage therapists,,21,4,9,Bodywork Therapist | Certified Massage Therapist (CMT) | Clinical Massage Therapist | Deep Tissue Massage Therapist | Integrated Deep Tissue Massage Therapist | Licensed Massage Practitioner (LMP) | Licensed Massage Therapist (LMT) | Massage Operator,computers and electronics | mathematics | telecommunications | engineering and technology,microsoft excel | appointmentquest online appointment manager | ics software sammyusa | land software customer pro-file | massage suite | scheduling software | spreadsheet software | wincity custom software wincity massage soap notes
31-9091.00,Dental Assistants,dental assistants,,21,4,10,Certified Dental Assistant (CDA) | Certified Registered Dental Assistant | Dental Aide | Dental Assistant (DA) | Dental Nurse | Dental Office Assistant | Dental Specialist | Dentist Attendant,computers and electronics | mathematics | telecommunications | engineering and technology,henry schein dentrix | microsoft excel | email software | kodak dental systems kodak softdent practice management software pms | open dental | patterson dental supply patterson eaglesoft | quicken | the systems workplace tdocs
31-9092.00,Medical Assistants,medical assistants,,42,4,15,Autopsy Assistant | Bilingual Medical Assistant | Cardiology Medical Assistant | Certified Medical Assistant (CMA) | Chiropractic Assistant | Chiropractor Assistant | Client Services Coordinator | Clinic Assistant,computers and electronics | mathematics | telecommunications | engineering and technology,epic systems | eclinicalworks ehr software | intuit quickbooks | meditech software | microsoft access | microsoft excel | microsoft sharepoint | appointment scheduling software
31-9093.00,Medical Equipment Preparers,medical equipment preparers,,41,4,15,Aseptic Technician (Aseptic Tech) | Bandage Maker | Central Processing Technician (CPT) | Central Service Technician (CST) | Central Sterile Processing Technician (Central Sterile Processing Tech) | Central Sterile Supply Technician (CSS Technician) | Central Sterile Technician (Central Sterile Tech) | Central Sterilization Technician,mathematics | computers and electronics | telecommunications | engineering and technology,eclinicalworks ehr software | kronos workforce timekeeper | meditech software | microsoft excel | microsoft sharepoint | calendar software | database software | email software
31-9094.00,Medical Transcriptionists,medical transcriptionists,,26,4,15,Certified Medical Transcriptionist | Clinical Medical Transcriptionist | Clinical Scribe | Data Transcriber | Documentation Specialist | Emergency Medical Scribe | Medical Assistant Scribe (MA Scribe) | Medical Language Professional,computers and electronics | telecommunications | mathematics | engineering and technology,eclinicalworks ehr software | microsoft access | microsoft asp net | microsoft excel | microsoft windows | allscripts healthcare automation software | boston bar systems corporation sonnet | bytescribe development company wavplayer
31-9095.00,Pharmacy Aides,pharmacy aides,,19,4,5,Certified Pharmacist Assistant | Dispensary Attendant | Drug Clerk | Drug Purchaser | Front Counter Clerk | Pharmaceutical Assistant | Pharmacist Aide | Pharmacist Assistant,mathematics | computers and electronics | telecommunications | engineering and technology,microsoft excel | microsoft windows | database software | spreadsheet software | word processing software
