onet_soc_code,canonical_title,normalized_canonical_title,matched_target_families,alternate_title_count,knowledge_count,technology_example_count,sample_alternate_titles,sample_top_knowledge,sample_top_technology_examples
11-1011.00,Chief Executives,chief executives,,75,4,15,Aeronautics Commission Director | Agency Owner | Agricultural Services Director | Arts and Humanities Council Director | Bank President | Bureau Chief | Business Development Executive (BD Executive) | Business Development Officer (BD Officer),computers and electronics | mathematics | engineering and technology | telecommunications,microsoft excel | adobe acrobat | atlassian jira | extensible markup language xml | intuit quickbooks | microsoft access | microsoft project | microsoft sharepoint
11-1011.03,Chief Sustainability Officers,chief sustainability officers,,25,4,15,"CSR and Sustainability VP (Corporate Social Responsibility and Sustainability Vice President) | Chief Environmental Commitment Officer (CECO) | Chief Green Officer (CGO) | Chief Sustainability Officer (CSO) | Climate Change and Sustainability Manager | Corporate Sustainability Manager | Corporate Sustainability Process Manager | ESG Manager (Environmental, Social, and Corporate Governance Manager)",mathematics | engineering and technology | computers and electronics | telecommunications,microsoft excel | adobe acrobat | adobe photoshop | facebook | microsoft access | microsoft project | microsoft sharepoint | salesforce software
11-1021.00,General and Operations Managers,general and operations managers,,74,4,15,Area Manager | Boards and Commissions Director | Business Coordinator | Business Manager | Center Manager | Chief Administrative Officer (CAO) | Corporate Manager | Department Manager,mathematics | engineering and technology | computers and electronics | telecommunications,microsoft excel | adobe acrobat | adobe creative cloud software | adobe photoshop | amazon web services aws software | apache hadoop | apple macos | atlassian confluence
11-1031.00,Legislators,legislators,,26,0,15,Alderman | Assembly Member | Assembly Person | Assemblyman | Assemblywoman | City Alderman | City Council Member | City Councilman,,adobe acrobat | cisco webex | microsoft access | microsoft excel | microsoft sharepoint | microsoft sql server | microsoft visual basic | structured query language sql
11-2011.00,Advertising and Promotions Managers,advertising and promotions managers,,47,4,15,Account Director | Account Executive | Account Manager | Account Specialist | Advertising Account Executive (Ad Account Executive) | Advertising Account Manager (Ad Account Manager) | Advertising Agency Manager (Ad Agency Manager) | Advertising Campaign Manager (Ad Campaign Manager),computers and electronics | mathematics | telecommunications | engineering and technology,google analytics | microsoft excel | salesforce software | adobe acrobat | adobe after effects | adobe creative cloud software | adobe illustrator | adobe indesign
11-2021.00,Marketing Managers,marketing managers,,40,4,15,Account Supervisor | Brand Manager | Business Developer | Business Development Director | Business Development Manager | Category Manager | Channel Manager | Commercial Director,computers and electronics | mathematics | telecommunications | engineering and technology,atlassian jira | microsoft excel | salesforce software | structured query language sql | adobe acrobat | adobe after effects | adobe creative cloud software | adobe illustrator
11-2022.00,Sales Managers,sales managers,,49,4,15,Account Manager | Area Sales Manager | Area Supervisor | BD Director (Business Development Director) | BD Executive (Business Development Executive) | BD Manager (Business Development Manager) | Business Developer | Channel Manager,computers and electronics | mathematics | engineering and technology | telecommunications,microsoft excel | salesforce software | adobe acrobat | adobe creative cloud software | bentley microstation | eclipse ide | facebook | google analytics
11-2032.00,Public Relations Managers,public relations managers,,24,0,15,Business Development Director | Campaign Manager | Communications Director | Communications Manager | Community Director | Community Engagement Manager | Community Manager | Community Relations Director,,microsoft excel | salesforce software | adobe acrobat | adobe after effects | adobe creative cloud software | adobe illustrator | adobe indesign | adobe photoshop
11-2033.00,Fundraising Managers,fundraising managers,,27,4,15,Account Manager | Account Supervisor | Advancement Director | Annual Giving Director | Campaign Manager | Canvass Director | Community Manager | Development Director,mathematics | computers and electronics | telecommunications | engineering and technology,microsoft excel | salesforce software | adobe acrobat | adobe after effects | adobe creative cloud software | adobe illustrator | adobe indesign | adobe photoshop
11-3012.00,Administrative Services Managers,administrative services managers,,17,4,15,Administration Director | Administrative Coordinator | Administrative Director | Administrative Manager | Administrative Officer | Administrative Services Manager | Administrator | Business Administrator,computers and electronics | mathematics | telecommunications | engineering and technology,microsoft excel | adobe acrobat | atlassian jira | autodesk autocad | google docs | ibm spss statistics | intuit quickbooks | microsoft access
11-3013.00,Facilities Managers,facilities managers,,29,4,15,Building Maintenance Superintendent | Building Manager | Building Services Supervisor | Conference Center Manager | Facilities Coordinator | Facilities Director | Facilities Electrical Engineer | Facilities Engineer,computers and electronics | mathematics | engineering and technology | telecommunications,microsoft excel | adobe acrobat | autodesk autocad | autodesk revit | google docs | google workspace software | intuit quickbooks | microsoft access
11-3013.01,Security Managers,security managers,,38,4,15,Chief Security Officer (CSO) | Cloud Security Manager | Corporate Physical Security Supervisor | Corporate Security Director | Corporate Security Manager | Global Security Manager | IS Security Manager (Information Systems Security Manager) | Industrial Security Specialist,computers and electronics | telecommunications | engineering and technology | mathematics,microsoft excel | sap software | amazon web services aws software | facebook | microsoft access | microsoft azure software | microsoft project | microsoft visio
11-3021.00,Computer and Information Systems Managers,computer and information systems managers,,58,4,15,Application Development Director | Chief Information Security Officer (CISO) | Computer Operations Manager | Computer Programming Manager | Computer Security Manager | Computer Systems Information Director | Computer and Information Systems Manager | Computing Services Director,computers and electronics | engineering and technology | mathematics | telecommunications,amazon web services aws software | microsoft azure software | apache cassandra | apache hadoop | apache maven | apache tomcat | apple macos | atlassian jira
11-3031.00,Financial Managers,financial managers,,59,4,15,ATM Manager (Automated Teller Machine Manager) | Accountant Supervisor | Accounting Director | Accounting Manager | Accounting Supervisor | Accounts Manager | Accounts Payable Manager | Accounts Supervisor,mathematics | computers and electronics | telecommunications | engineering and technology,microsoft excel | sap software | adobe acrobat | alteryx software | ibm spss statistics | intuit quickbooks | marketo marketing automation | microsoft access
11-3031.01,Treasurers and Controllers,treasurers and controllers,,23,4,15,City Comptroller | City Controller | City Treasurer | Comptroller | Controller | Corporate Controller | Corporate Treasurer | Cost Controller,mathematics | computers and electronics | engineering and technology | telecommunications,intuit quickbooks | microsoft excel | sap software | hypertext markup language html | microsoft access | microsoft project | oracle peoplesoft | oracle primavera enterprise project portfolio management
11-3031.03,Investment Fund Managers,investment fund managers,,23,4,15,Annual Fund Manager | Asset Management Manager | Asset Management Project Manager | Asset Manager | Digital Asset Manager | Financial Planning Director | Financial Planning Manager | Financial Planning and Analysis Finance Manager,mathematics | computers and electronics | telecommunications | engineering and technology,microsoft excel | microsoft access | microsoft power bi | microsoft project | microsoft visio | sap software | sas | structured query language sql
11-3051.00,Industrial Production Managers,industrial production managers,,47,4,15,Area Plant Manager | Assembly Manager | Bulk Plant Manager | Car Construction Superintendent | Concrete Mixing Plant Superintendent | Correctional Facility Industries Superintendent | Factory Manager | Factory Superintendent,mathematics | engineering and technology | computers and electronics | telecommunications,microsoft excel | sap software | adobe acrobat | adobe after effects | adobe indesign | adobe photoshop | autodesk autocad | intuit quickbooks
11-3051.01,Quality Control Systems Managers,quality control systems managers,,19,4,15,Construction Quality Control Manager | Product Quality Director | Quality Assurance Coordinator (QA Coordinator) | Quality Assurance Director (QA Director) | Quality Assurance Manager (QA Manager) | Quality Assurance Supervisor (QA Supervisor) | Quality Control Director (QC Director) | Quality Control Manager (QC Manager),mathematics | engineering and technology | computers and electronics | telecommunications,microsoft excel | adobe acrobat | atlassian jira | extensible markup language xml | linux | microsoft access | microsoft project | microsoft sql server
11-3051.02,Geothermal Production Managers,geothermal production managers,,13,4,5,Decommissioning Well Site Manager | Geothermal Operations Manager | Geothermal Plant Manager | Geothermal Product Manager | Geothermal Production Manager | Industrial Production Manager | Mitigation Supervisor | Plant Manager,mathematics | engineering and technology | computers and electronics | telecommunications,microsoft access | microsoft excel | data logging software | infostat rimbase | personnel scheduling software
11-3051.03,Biofuels Production Managers,biofuels production managers,,18,4,9,Biodiesel Operations Manager | Biodiesel Plant Manager | Biodiesel Plant Superintendent | Biofuels Operations Manager | Biofuels Plant Manager | Biofuels Plant Superintendent | Biofuels Production Manager | Ethanol Operations Manager,engineering and technology | mathematics | computers and electronics | telecommunications,adobe acrobat | autodesk autocad | microsoft excel | computerized maintenance management system cmms | distributed control system dcs | employee scheduling software | human machine interface hmi software | inventory control software
11-3051.04,Biomass Power Plant Managers,biomass power plant managers,,14,4,6,Biomass Plant Manager | Biomass Power Plant Manager | Biomass Power Plant Superintendent | Biomass Production Manager | Demand Generator Manager | Fuel Manager | Maintenance Manager | Maintenance Superintendent,engineering and technology | mathematics | computers and electronics | telecommunications,microsoft excel | computer aided design cad software | computerized maintenance management system cmms | distributed control system dcs | employee scheduling software | inventory control software
11-3051.06,Hydroelectric Production Managers,hydroelectric production managers,,17,4,15,Demand Generation Manager | Generation Manager | Hydroelectric Generation Manager (Hydro Generation Manager) | Hydroelectric Generation Supervisor (Hydro Generation Supervisor) | Hydroelectric Plant Site Manager (Hydro Plant Site Manager) | Hydroelectric Production Manager | Hydroelectric Station Chief | Hydroelectric Station Supervisor (Hydro Station Supervisor),engineering and technology | computers and electronics | mathematics | telecommunications,apache kafka | microsoft access | microsoft active server pages asp | microsoft excel | microsoft project | microsoft sql server | oracle database | sap software
11-3061.00,Purchasing Managers,purchasing managers,,25,4,15,Category Purchasing Manager | Commissary Superintendent | Commodity Manager | Contract Manager | Contracting Manager | Division Merchandise Manager (DMM) | General Merchandise Manager | Materials Director,computers and electronics | mathematics | telecommunications | engineering and technology,microsoft excel | sap software | microsoft access | microsoft project | microsoft sharepoint | microsoft visio | oracle database | oracle peoplesoft
11-3071.00,"Transportation, Storage, and Distribution Managers",transportation storage and distribution managers,,124,4,15,Aerial Planting and Cultivation Manager | Air Export Logistics Manager | Airport Manager | Ammunition Storage Superintendent | Area Manager | Auto Fleet Manager | Automotive Services Manager | Bridges Supervisor,mathematics | computers and electronics | telecommunications | engineering and technology,microsoft excel | autodesk autocad civil 3d | bentley microstation | microsoft access | microsoft project | microsoft sql server | microsoft visio | oracle primavera enterprise project portfolio management
11-3071.04,Supply Chain Managers,supply chain managers,,31,4,15,Auto Parts Manager (Automotive Parts Manager) | Demand Planning Manager | Global Supply Chain Director | Global Supply Chain Manager | Inventory Control Supervisor | Inventory Manager | Inventory Supervisor | Logistics Supervisor,mathematics | computers and electronics | engineering and technology | telecommunications,microsoft excel | sap software | meditech software | microsoft access | microsoft project | microsoft sharepoint | microsoft sql server | microsoft visio
11-3111.00,Compensation and Benefits Managers,compensation and benefits managers,,27,4,15,Benefits Admin (Benefits Administrator) | Benefits Advisor | Benefits Coordinator | Benefits Director | Benefits Manager | Compensation Director | Compensation Manager | Compensation Program Manager,mathematics | computers and electronics | telecommunications | engineering and technology,microsoft excel | workday software | adobe illustrator | adobe photoshop | intuit quickbooks | microsoft access | microsoft project | microsoft sharepoint
11-3121.00,Human Resources Managers,human resources managers,,31,4,15,Diversity Manager | Diversity and Inclusion Director | Efficiency Manager | Employee Relations Manager | Employee Welfare Manager | Employment Manager | HR Admin Director (Human Resources Administration Director) | HR Coordinator (Human Resources Coordinator),computers and electronics | mathematics | telecommunications | engineering and technology,microsoft excel | workday software | facebook | ibm spss statistics | intuit quickbooks | kronos workforce timekeeper | microsoft access | microsoft project
11-3131.00,Training and Development Managers,training and development managers,,39,4,15,Apprenticeship Consultant | Development Associate | Development Coordinator | Development Director | E-Learning Manager (Electronic Learning Manager) | Education and Development Manager | Education and Training Manager | Employee Development Director,computers and electronics | mathematics | telecommunications | engineering and technology,microsoft excel | adobe acrobat | adobe illustrator | adobe photoshop | apache cassandra | cisco webex | epic systems | javascript
11-9013.00,"Farmers, Ranchers, and Other Agricultural Managers",farmers ranchers and other agricultural managers,,73,4,15,Accredited Farm Manager (AFM) | Activation Manager | Agricultural Crop Farm Manager | Agricultural Manager | Agriculture Farmer | Agriculture Manager | Agronomy Manager | Agronomy Operations Manager,mathematics | engineering and technology | computers and electronics | telecommunications,microsoft excel | adobe photoshop | atlassian confluence | facebook | microsoft access | microsoft visio | sap software | accutech systems corporation accufarm-mgr
11-9021.00,Construction Managers,construction managers,,32,4,15,Bridges and Buildings Supervisor | Commercial Construction Project Manager | Commercial Construction Superintendent | Commercial Superintendent | Concrete Foreman | Construction Area Manager | Construction Coordinator | Construction Director,mathematics | engineering and technology | computers and electronics | telecommunications,microsoft excel | microsoft project | procore software | adobe acrobat | adobe creative cloud software | autodesk autocad | autodesk autocad civil 3d | autodesk revit
11-9031.00,"Education and Childcare Administrators, Preschool and Daycare",education and childcare administrators preschool and daycare,,39,4,15,After School Site Director | Art Coordinator | Assessment Coordinator | Before and After School Program Director | Before and After School Site Director | Center Administrator | Center Manager | Child Care Center Administrator,mathematics | computers and electronics | engineering and technology | telecommunications,intuit quickbooks | microsoft excel | acs technologies headmaster | auburn software debit square | b and i computer consultants childcare sage | bloomz | cirrus group daycare works | echurch com schoolperfect
11-9032.00,"Education Administrators, Kindergarten through Secondary",education administrators kindergarten through secondary,,41,4,15,Academic Advisor | Assessment Coordinator | Athletic Coordinator | Athletic Director | Commission for the Blind Director | Curriculum Director | Curriculum and Instruction Superintendent | Education Supervisor,mathematics | computers and electronics | engineering and technology | telecommunications,microsoft excel | apache cassandra | ibm spss statistics | microsoft access | microsoft sharepoint | sas | the mathworks matlab | student information systems sis software
11-9033.00,"Education Administrators, Postsecondary",education administrators postsecondary,,69,4,15,Academic Affairs Dean | Academic Affairs Director | Academic Affairs Vice President (Academic Affairs VP) | Academic Coordinator | Academic Dean | Academic Vice President (Academic VP) | Administration Dean | Admissions Coordinator,computers and electronics | mathematics | telecommunications | engineering and technology,microsoft excel | facebook | google docs | hypertext markup language html | ibm spss statistics | microsoft access | microsoft project | microsoft sharepoint
11-9039.00,"Education Administrators, All Other",education administrators all other,,27,0,0,Apprenticeship Consultant | Apprenticeship Representative | Area Supervisor | Attache | Community Health Nursing Educational Director | Correctional Institution Education Supervisor | Director of Extension Work | Director of Health Education,,
11-9041.00,Architectural and Engineering Managers,architectural and engineering managers,,33,4,15,Architect Manager | Architectural Project Manager | Civil Engineering Manager | Civil Project Manager (Civil PM) | Data Engineering Director | Data Engineering Manager | Electrical Engineering Director | Electrical Engineering Manager,engineering and technology | mathematics | computers and electronics | telecommunications,autodesk autocad | microsoft excel | amazon dynamodb | amazon elastic compute cloud ec2 | amazon redshift | amazon web services aws software | ansible software | apache cassandra
11-9041.01,Biofuels/Biodiesel Technology and Product Development Managers,biofuels / biodiesel technology and product development managers,,18,4,15,Analytical Research Program Manager | Biodiesel Division Manager | Biodiesel Engineering Manager | Biodiesel Product Development Manager | Biodiesel Product Manager | Biodiesel Technology Development Manager | Biodiesel Technology Manager | Biofuels Engineering Manager,engineering and technology | mathematics | computers and electronics | telecommunications,adobe illustrator | epic systems | linux | microsoft excel | microsoft project | microsoft sql server | microsoft sql server integration services ssis | microsoft sql server reporting services ssrs
11-9051.00,Food Service Managers,food service managers,,45,4,15,Banquet Director | Banquet Manager | CDM (Certified Dietary Manager) | CFPP (Certified Food Protection Professional) | Cafe Operator | Cafeteria Director | Cafeteria Manager | Cafeteria Operator,mathematics | computers and electronics | telecommunications | engineering and technology,facebook | google docs | intuit quickbooks | microsoft excel | microsoft project | aestiva employee time clock | apache groovy | army food management information system
11-9071.00,Gambling Managers,gambling managers,,33,4,4,Baccarat Manager | Bingo Manager | Blackjack Manager | Cage Manager | Cage Shift Manager | Card Room Manager | Casino Manager | Casino Operations Manager,mathematics | computers and electronics | engineering and technology | telecommunications,microsoft excel | employee scheduling software | human resources management system hrms | web browser software
11-9072.00,"Entertainment and Recreation Managers, Except Gambling",entertainment and recreation managers except gambling,,58,4,15,Activities Manager | Amusement Park Manager | Aquatics Director | Aquatics Manager | Boat Club Manager | Camp Director | Camp and Recreation Manager | Club Director,computers and electronics | mathematics | telecommunications | engineering and technology,microsoft excel | adobe acrobat | apple macos | atlassian confluence | cisco webex | facebook | google docs | hubspot software
11-9081.00,Lodging Managers,lodging managers,,48,4,15,Accommodations General Manager | Accommodations Manager | Agricultural Labor Camp Manager | Apartment Coordinator | Bed and Breakfast Innkeeper | Boardinghouse Keeper | Camp Director | Campground Manager,mathematics | computers and electronics | telecommunications | engineering and technology,microsoft excel | facebook | microsoft access | property management system pms software | accounting software | anand systems asi frontdesk | delphi technology | email software
11-9111.00,Medical and Health Services Managers,medical and health services managers,,95,4,15,Assisted Living Administrator | Assisted Living Manager | Cancer Center Director | Care Coordinator | Client Services Director | Clinic Director | Clinical Director | Clinical Informatics Director,computers and electronics | mathematics | engineering and technology | telecommunications,microsoft excel | adobe acrobat | apache hadoop | apache maven | autodesk revit | cisco webex | eclinicalworks ehr software | epic systems
11-9121.00,Natural Sciences Managers,natural sciences managers,,34,4,15,Agricultural Research Director | Agriculture Research Director | Analytical Services Manager | Chemical Engineer Supervisor | Chemical Plant Technical Director | Chemical Process Exploration Manager | Clinical Project Manager | Clinical Trials Manager,computers and electronics | mathematics | engineering and technology | telecommunications,microsoft excel | r | adobe acrobat | adobe photoshop | esri arcgis software | ibm spss statistics | microsoft access | microsoft project
11-9121.01,Clinical Research Coordinators,clinical research coordinators,,22,4,15,Clinical Coordinator | Clinical Data Coordinator | Clinical Manager | Clinical Program Coordinator | Clinical Program Manager | Clinical Project Manager | Clinical Research Administrator | Clinical Research Coordinator,computers and electronics | mathematics | telecommunications | engineering and technology,microsoft excel | ibm spss statistics | microsoft access | microsoft project | python | r | sas | the mathworks matlab
11-9121.02,Water Resource Specialists,water resource specialists,,14,4,15,Community Resource Consultant | Environmental Resource Specialist | Hydrotechnical Specialist | Hydrotechnician | Power Supply Engineer | Resource Specialist | Water Quality Specialist | Water Resource Agent,engineering and technology | mathematics | computers and electronics | telecommunications,esri arcgis software | microsoft excel | autodesk autocad | structured query language sql | geographic information system gis systems | customer relationship management crm software | database software | dhi mike urban
11-9131.00,Postmasters and Mail Superintendents,postmasters and mail superintendents,,15,4,15,Delivery Supervisor | Distribution Operation Supervisor (SDO) | Distribution Operations Manager | Distribution Operations Supervisor | Mail Delivery Supervisor | Mail Superintendent | Order to Delivery Supervisor | Postal Service Sectional Center Manager,mathematics | computers and electronics | telecommunications | engineering and technology,microsoft excel | microsoft windows | sap software | collection point management system cpms | ebuy | email software | facility database software | payroll software
11-9141.00,"Property, Real Estate, and Community Association Managers",property real estate and community association managers,,64,4,15,Apartment Community Manager | Apartment House Manager | Apartment Manager | Apartment Property Manager | Building Rental Manager | Building Rental Superintendent | Building Superintendent | Cemetery Manager,mathematics | computers and electronics | telecommunications | engineering and technology,microsoft excel | yardi software | facebook | google analytics | google docs | hypertext markup language html | intuit quickbooks | microsoft access
